{
  "schema_version": "external-frame-atlas-source-evaluation/v1",
  "matrix_kind": "metadata_only_source_evaluation",
  "issue": "#138",
  "records": [
    {
      "source_id": "sf6frames",
      "source_name": "SF6Frames",
      "source_kind": "external_visual_atlas",
      "source_url": "https://sf6frames.com/",
      "candidate_role": [
        "visual hitbox/hurtbox reference candidate",
        "hitbox-overlay visual reference candidate",
        "frame-numbered visual reference candidate where available",
        "not numeric frame-data authority"
      ],
      "coverage_notes": "Manual public-page review shows an image-heavy SF6 hitbox/hurtbox frame viewer with character navigation, move category navigation, dated animation notes, frame-numbered visual references, and share-oriented animation links. Coverage appears useful for visual review but must stay permission-first and metadata-only in #138.",
      "move_category_coverage": "Common normals, unique attacks, special attacks, and character-specific animation pages appear discoverable from public navigation; coverage limits and completeness require later review.",
      "hitbox_overlay_available": "yes",
      "clean_visual_available": "unknown",
      "frame_numbers_visible": "yes",
      "update_cadence_notes": "Public site news and page notes show dated updates; this is freshness context only and not current-fact authority.",
      "machine_readability_notes": "Navigation appears structured enough for a future feasibility review, but #138 records no selectors and implements no retrieval.",
      "asset_url_stability_notes": "Animation share links are visible as a site feature, but direct asset URL stability was not tested and no asset URLs were inspected or stored.",
      "robots_or_terms_reviewed": "limited_manual_review",
      "rate_limit_policy": "requires_later_review",
      "attribution_required": "unknown",
      "permission_status": "reviewed_no_explicit_permission",
      "license_status": "no_explicit_license_found",
      "redistribution_status": "permission_required",
      "risk_level": "high",
      "recommended_status": "hold_terms_or_permission",
      "not_current_fact_authority": true,
      "may_override_official_raw": false,
      "numeric_frame_data_ingestion_allowed": false,
      "public_bundle_allowed": false,
      "binary_asset_storage_allowed": false,
      "repo_external_cache_candidate": true,
      "future_cache_sync_status": "candidate_requires_terms_review",
      "analysis_use": [
        "candidate move identification review support",
        "candidate hit/block/whiff observation support",
        "human reviewer visual confirmation",
        "official_raw consistency review prompt"
      ],
      "forbidden_use": [
        "numeric frame-data ingestion",
        "official_raw override",
        "public bundle binary inclusion",
        "normal public answer scrape or cache",
        "CI external asset fetch",
        "exact current-fact authority"
      ],
      "existing_fetch_tooling_alignment": "align_with_ingest_frame_data_scrapling_stack_if_later_approved",
      "future_acquisition_tooling": "scrapling_candidate_not_implemented",
      "new_fetch_dependency_required": false,
      "future_cache_sync_scope": "later_explicit_maintainer_local_repo_external_cache_issue_required",
      "checked_in_raw_snapshot_allowed": false
    },
    {
      "source_id": "ultimate_frame_data",
      "source_name": "Ultimate Frame Data",
      "source_kind": "external_visual_atlas",
      "source_url": "https://ultimateframedata.com/sf6/",
      "candidate_role": [
        "broad move-table and hitbox image reference candidate",
        "cross-check and source evaluation context",
        "not numeric frame-data authority"
      ],
      "coverage_notes": "Manual public-page review shows SF6 character navigation, hitbox color notes, data source notes, and hitbox animation context. The source may be useful for visual reference evaluation, but numeric values are not ingestion authority in #138.",
      "move_category_coverage": "Character pages and broad move-table style navigation appear available; move category completeness and mapping to repo move IDs require later review.",
      "hitbox_overlay_available": "yes",
      "clean_visual_available": "unknown",
      "frame_numbers_visible": "unknown",
      "update_cadence_notes": "Patch and update cadence was not fully reviewed in #138.",
      "machine_readability_notes": "Public navigation appears structured, but #138 records no selectors and does not test retrieval.",
      "asset_url_stability_notes": "Hitbox image or animation URL stability was not tested; no direct binary asset URL was inspected or stored.",
      "robots_or_terms_reviewed": "not_reviewed",
      "rate_limit_policy": "not_reviewed",
      "attribution_required": "unknown",
      "permission_status": "not_reviewed",
      "license_status": "not_reviewed",
      "redistribution_status": "permission_required",
      "risk_level": "high",
      "recommended_status": "hold_terms_or_permission",
      "not_current_fact_authority": true,
      "may_override_official_raw": false,
      "numeric_frame_data_ingestion_allowed": false,
      "public_bundle_allowed": false,
      "binary_asset_storage_allowed": false,
      "repo_external_cache_candidate": true,
      "future_cache_sync_status": "candidate_requires_terms_review",
      "analysis_use": [
        "visual reference source evaluation",
        "candidate move identification review support",
        "human reviewer cross-check context"
      ],
      "forbidden_use": [
        "numeric frame-data ingestion",
        "official_raw override",
        "public bundle binary inclusion",
        "normal public answer scrape or cache",
        "CI external asset fetch",
        "exact current-fact authority"
      ],
      "existing_fetch_tooling_alignment": "align_with_ingest_frame_data_scrapling_stack_if_later_approved",
      "future_acquisition_tooling": "scrapling_candidate_not_implemented",
      "new_fetch_dependency_required": false,
      "future_cache_sync_scope": "later_explicit_maintainer_local_repo_external_cache_issue_required",
      "checked_in_raw_snapshot_allowed": false
    },
    {
      "source_id": "maintainer_local_captured_references",
      "source_name": "Maintainer-local captured references",
      "source_kind": "maintainer_local_placeholder",
      "source_url": "maintainer-local:captured-references",
      "candidate_role": [
        "maintainer-local captured visual reference placeholder",
        "local-only future workflow candidate",
        "not repo binary storage",
        "not public bundle behavior"
      ],
      "coverage_notes": "Placeholder for future maintainer-local captures reviewed outside public bundle behavior. #138 does not add captures, cache paths, hashes, dimensions, or binaries.",
      "move_category_coverage": "Unknown until a later explicit local-capture workflow defines scope and permission boundaries.",
      "hitbox_overlay_available": "unknown",
      "clean_visual_available": "unknown",
      "frame_numbers_visible": "unknown",
      "update_cadence_notes": "Not applicable until later explicit local capture workflow exists.",
      "machine_readability_notes": "Not implemented; future local metadata would need explicit manifest and validator scope.",
      "asset_url_stability_notes": "Not applicable; no asset URLs are stored in #138.",
      "robots_or_terms_reviewed": "not_applicable",
      "rate_limit_policy": "not_applicable",
      "attribution_required": "unknown",
      "permission_status": "permission_required",
      "license_status": "permission_required",
      "redistribution_status": "not_allowed_by_default",
      "risk_level": "unknown",
      "recommended_status": "candidate_metadata_only",
      "not_current_fact_authority": true,
      "may_override_official_raw": false,
      "numeric_frame_data_ingestion_allowed": false,
      "public_bundle_allowed": false,
      "binary_asset_storage_allowed": false,
      "repo_external_cache_candidate": true,
      "future_cache_sync_status": "candidate_metadata_only_until_approved",
      "analysis_use": [
        "future maintainer-local visual review support",
        "future metadata-only manifest candidate"
      ],
      "forbidden_use": [
        "repo binary storage",
        "public bundle binary inclusion",
        "official_raw override",
        "exact current-fact authority",
        "CI external asset fetch"
      ],
      "existing_fetch_tooling_alignment": "not_applicable",
      "future_acquisition_tooling": "manual_review_only",
      "new_fetch_dependency_required": false,
      "future_cache_sync_scope": "later_explicit_maintainer_local_repo_external_cache_issue_required",
      "checked_in_raw_snapshot_allowed": false
    },
    {
      "source_id": "official_raw_comparison_boundary",
      "source_name": "Official/current-fact authority comparison boundary",
      "source_kind": "current_fact_authority_boundary",
      "source_url": "repo:official_raw",
      "candidate_role": [
        "current-fact authority comparison boundary",
        "packaged official_raw remains authority",
        "not external visual atlas binary source"
      ],
      "coverage_notes": "Represents the repo authority boundary for comparison only. It is not a source of external visual atlas binaries and is not modified by #138.",
      "move_category_coverage": "Current published frame-data authority is handled by existing official_raw surfaces outside this matrix.",
      "hitbox_overlay_available": "not_applicable",
      "clean_visual_available": "not_applicable",
      "frame_numbers_visible": "not_applicable",
      "update_cadence_notes": "Handled by existing frame-data refresh and published snapshot surfaces, not by external visual atlas evaluation.",